{
  "schema_version": "1.0.0",
  "registry_id": "hippocampus-foundation-public-evaluations-v1",
  "generated_at": "2026-08-16T11:43:22Z",
  "evaluation_protocol": {
    "decision": "Determine whether a frozen system can retrieve, reason over, and abstain on evidence-grounded graph-memory tasks without exposure to evaluation source families during foundation construction.",
    "prediction_time": "At task inference, before any outcome, answer, hidden label, or confirmatory result is disclosed.",
    "unit_of_analysis": ["claim", "contract", "event relation", "generated theory world", "paper intervention-outcome", "story or process question"],
    "available_information": ["declared task input", "evidence explicitly supplied by the task", "frozen graph snapshot only when the registered task protocol permits it"],
    "population": "The pinned official releases of the seven declared public evaluation families, evaluated without adapting to confirmatory results.",
    "split_units": ["document or source work", "entity or incident family", "generator world, grammar, and seed family", "time window"],
    "metrics": ["dataset-native primary metric", "abstention coverage-risk", "exact contamination rate", "near-duplicate contamination rate"],
    "error_cost_policy": "Report each dataset and safety metric separately; no scalar average may conceal contamination, unsupported answers, or high-cost false acceptance."
  },
  "datasets": [
    {
      "dataset_id": "vitaminc",
      "official_source": "https://github.com/TalSchuster/VitaminC",
      "pin_policy": "highest_stable_release_then_commit",
      "resolved_version": null,
      "archive_sha256": null,
      "seal_id": "vitaminc-confirmatory-v1",
      "evaluation_class": "confirmatory_only",
      "licence_status": "pending",
      "dependency_units": ["claim_family", "source_document_family", "wikipedia_page_family", "wikipedia_revision_family"],
      "foundation_exclusion": "all_dataset_source_families",
      "status": "declared",
      "blockers": ["archive_not_acquired", "licence_not_reviewed", "quarantine_not_compiled", "seal_missing", "version_not_pinned"]
    },
    {
      "dataset_id": "maven-ere",
      "official_source": "https://github.com/THU-KEG/MAVEN-ERE",
      "pin_policy": "highest_stable_release_then_commit",
      "resolved_version": null,
      "archive_sha256": null,
      "seal_id": "maven-ere-confirmatory-v1",
      "evaluation_class": "confirmatory_only",
      "licence_status": "pending",
      "dependency_units": ["document_family", "event_cluster", "event_pair", "time_window"],
      "foundation_exclusion": "all_dataset_source_families",
      "status": "declared",
      "blockers": ["archive_not_acquired", "licence_not_reviewed", "quarantine_not_compiled", "seal_missing", "version_not_pinned"]
    },
    {
      "dataset_id": "evidence-inference",
      "official_source": "https://evidence-inference.ebm-nlp.com/download/",
      "pin_policy": "highest_stable_release_then_commit",
      "resolved_version": null,
      "archive_sha256": null,
      "seal_id": "evidence-inference-confirmatory-v1",
      "evaluation_class": "confirmatory_only",
      "licence_status": "pending",
      "dependency_units": ["doi_pmid_pmcid_family", "paper_family", "publication_family", "trial_report_family"],
      "foundation_exclusion": "all_dataset_source_families",
      "status": "declared",
      "blockers": ["archive_not_acquired", "licence_not_reviewed", "quarantine_not_compiled", "seal_missing", "version_not_pinned"]
    },
    {
      "dataset_id": "contractnli",
      "official_source": "https://stanfordnlp.github.io/contract-nli/",
      "pin_policy": "highest_stable_release_then_commit",
      "resolved_version": null,
      "archive_sha256": null,
      "seal_id": "contractnli-confirmatory-v1",
      "evaluation_class": "confirmatory_only",
      "licence_status": "pending",
      "dependency_units": ["clause_family", "contract_family", "organisation_family", "source_filing_family"],
      "foundation_exclusion": "all_dataset_source_families",
      "status": "declared",
      "blockers": ["archive_not_acquired", "licence_not_reviewed", "quarantine_not_compiled", "seal_missing", "version_not_pinned"]
    },
    {
      "dataset_id": "proofwriter",
      "official_source": "https://allenai.org/data/proofwriter",
      "pin_policy": "highest_stable_release_then_commit",
      "resolved_version": null,
      "archive_sha256": null,
      "seal_id": "proofwriter-confirmatory-v1",
      "evaluation_class": "confirmatory_only",
      "licence_status": "pending",
      "dependency_units": ["generator_grammar", "generator_seed_family", "generator_world"],
      "foundation_exclusion": "all_dataset_source_families",
      "status": "declared",
      "blockers": ["archive_not_acquired", "licence_not_reviewed", "quarantine_not_compiled", "seal_missing", "version_not_pinned"]
    },
    {
      "dataset_id": "glucose",
      "official_source": "https://aclanthology.org/2020.emnlp-main.370/",
      "pin_policy": "highest_stable_release_then_commit",
      "resolved_version": null,
      "archive_sha256": null,
      "seal_id": "glucose-confirmatory-v1",
      "evaluation_class": "confirmatory_only",
      "licence_status": "pending",
      "dependency_units": ["source_work_family", "story_family", "story_instance_family"],
      "foundation_exclusion": "all_dataset_source_families",
      "status": "declared",
      "blockers": ["archive_not_acquired", "licence_not_reviewed", "official_archive_not_resolved", "quarantine_not_compiled", "seal_missing", "version_not_pinned"]
    },
    {
      "dataset_id": "wiqa",
      "official_source": "https://allenai.org/data/wiqa",
      "pin_policy": "highest_stable_release_then_commit",
      "resolved_version": null,
      "archive_sha256": null,
      "seal_id": "wiqa-confirmatory-v1",
      "evaluation_class": "confirmatory_only",
      "licence_status": "pending",
      "dependency_units": ["causal_process_family", "paragraph_family", "source_dataset_family", "source_document_family"],
      "foundation_exclusion": "all_dataset_source_families",
      "status": "declared",
      "blockers": ["archive_not_acquired", "licence_not_reviewed", "quarantine_not_compiled", "seal_missing", "version_not_pinned"]
    }
  ],
  "closure_policy": {
    "policy_id": "quarantine-closure-v1",
    "relationship_types": [
      "case_family",
      "claimant_family",
      "contract_family",
      "generator_grammar",
      "generator_seed_family",
      "generator_world",
      "incident_statement",
      "near_duplicate_cluster",
      "organisation_family",
      "page_family",
      "paper_family",
      "publisher_family",
      "redirect_to",
      "revision_of",
      "same_work",
      "sitelink",
      "story_family",
      "time_window",
      "title_alias"
    ],
    "normalization": "unicode-nfkc-casefold-whitespace-v1",
    "near_duplicate": {
      "algorithm": "sha256-minhash-v1",
      "permutations": 128,
      "word_shingle_size": 5,
      "jaccard_threshold": 0.85,
      "short_document_words": 50,
      "short_character_shingle_size": 5,
      "short_jaccard_threshold": 0.9,
      "seed": "hippocampus-foundation-quarantine-v1"
    }
  }
}
